storyID,comment,questionBefores,questionAfter,choiceIns,choiceOuts,content
q0152,,q0151,q0153,,,"You explain the situation, and she dispatches grandpa right away.  You start scrolling through your phone, anything to distract yourself from the pain, and grandpa is there at your side not twenty minutes later.  He’s a little out of breath and concerned for your injury, but overall happy to see you.  “These woods make me nervous at night.  Not a good place to be when you’re hurt,” he says, confirming you’ve made the right call.  “Come along.”"
q0153,,q0152,q0154,,,"He helps you up and hands you a crutch to help you walk, then pulls the still-bundled tent over his shoulder and hangs the picnic basket over the crook of his elbow.  You both have a flashlight, and while they’re on the night seems a lot darker, but you also feel more confident about following the path."
q0154,,q0153,END,,,"Together, you make it slowly but surely out of the woods.  Grandma is waiting for you by the back door, fretting nervously with her hands.  She gives you a grateful hug and ushers you inside, where she tells you she’s made your favorite for dinner.  “Are there still cookies left for dessert?”  She laughs.  “Of course there are.  Now come on in!”"
q0160,(make do for the night),,q0161,c0142.1,,"The ankle might be swelling, but the pain is already lessening to a tolerable amount.  You think you can make it through the night, and if you really need to you can choose to call in the morning.  Might as well wait and see how you’ll feel then rather than ruin your trip by an early judgment call."
q0161,,q0160,q0162,,,"With a few preparatory breaths and your hands steadily on the ground, you manage to make it to your feet with only the slightest wobble.  You test your foot with a couple of steps.  Even though it stings, the pain is not as bad as you had thought originally.  Given a few more minutes of rest, you should be right as rain—or at least able to hobble around to set up camp."
q0162,,q0161,q0163,,,"Those few minutes stabilize your heart rate and slow down your thinking.  You’ll have to set up your tent, for one thing.  The night is getting cold as surely as it’s getting darker, and the tempered material of the tent should help keep a lot of the wind away."
q0163,,q0162,q0175,,,"You’ll need some kind of light source to see by.  There’s a flashlight in the picnic basket, but a fire would give off more light.  The heat would probably also help your ankle feel better."
q0170,(shake it off),,q0171,c0140.1,,"It’s gotten quite dark under cover of the trees.  When you look up, you can’t see the sun anymore.  Venus is shining through the clouds, however, in the violet sky.  You stand shakily to your feet, and your leg immediately buckles underneath you.  Your ankle definitely hurts, but after a few bracing breaths and some words of encouragement, you’re able to stand up mostly straight."
q0171,,q0170,q0172,,,"You bend down, balancing like a yogi to distribute your weight in a less painful manner, and with one hand on your good leg, you pick up the tent with the other, and drag it over to the cleared space behind the stone firepit."
q0172,,q0171,q0173,,,"You go back and pick up the basket, having an easier time of it, although your ankle still throbs in time with your heartbeat, which is still sounding quite loudly in your ears.  The felled tree trunk is at a good height for sitting, so you struggle over to it and sit down gratefully as you go over your itinerary for the night."
q0173,,q0172,q0174,,,"Obviously you’re going to have to camp here.  You were expecting it—it was the goal for this trip, after all—but trying to walk anywhere on your hurt ankle is now out of the question.  You’re not crying over it, but you can feel from the uncomfortable pressure from your shoe that it’s starting to swell, and it’s better to let it rest up than to push it—who knows what else you might trip on in the dark if you try to make it back tonight?"
q0174,,q0173,q0175,,,"Before you can sleep, you need to set up your tent.  You’ll need some light for that, so getting some light would be a smart first step.  There’s a flashlight in the basket, but a fire would give off more light.  The heat might also help your ankle feel better, or at least allow you to ignore some of the pain.  A slight chill has taken hold of the night, and you can feel it cutting through the thin fabric of your coat with every gust that drops down through the clearing.  A fire would be perfect."
q0175,,q0174,q0176,,,"You also need to eat.  You watched your grandma pack the basket, and know that there’s just a couple sandwiches in there, plus some hard-boiled eggs and an apple.  Nothing needs to be cooked, so if you can’t manage to gather firewood right now it won’t be the end of the world."
q0176,,q0175,,,"c0176.0, c0176.1","The clearing becomes incrementally darker with every passing minute.  You need to set up your tent, but with what light?"
q0180,,,q0181,c0023.1,,"There’s a log, and it’s blocking your path.  You can climb over it, but from the parts of the path that you can see, it looks too thorny and closed in for you to easily navigate through.  It might be worth it, but not while you’re carrying your bulky tent on your back.  It makes more sense to go set up camp and come back later."
q0181,,q0180,,,"c0023.0, c0114.2","You make it back to the fork.  Left brings you to the clearing, while going back the way you came takes you out of the woods."